title,company,location,description,salary_min,salary_max,created,category
Human Research Data Analyst,Keywords Studios,India,"Keywords Studios , established in Dublin in 1998, now has 70 studios across Europe, North and South America and Asia with 11,000 employee strength located across 5 continents and 23 countries. The company provides a complete outsourced game art, engineering, testing, audio and localization service for all Console, PC, Handheld and Mobile content, to many of the biggest names in games and interactive entertainment, working on thousands of titles including many of the best-selling titles of the p…",,,2025-07-25T11:16:46Z,IT Jobs
Data Analyst Founder Office,Seekho,India,"We are hiring an Analyst for the Founder’s Office at Seekho. You will work directly with the founders to generate data-backed insights that support investor communication and drive meaningful jumps in business metrics . What you’ll do Answer critical business and investor questions using data. Proactively analyze large datasets to uncover new, actionable insights. Track, analyze, and report key metrics with high accuracy. Requirements 1–2 years of experience as an analyst (preferably in a fast-…",,,2025-12-26T16:45:25Z,IT Jobs
Require a data analyst in hyderabad,TestHiring,"Hussainialam, Hyderabad","Collect, clean, and validate data from multiple administrative systems and sources to ensure accuracy and consistency. Develop and maintain dashboards and reports using tools such as Power BI, Tableau, or Excel to track KPIs related to operations, budgeting, and resource utilization. Perform in-depth data analysis to identify trends, anomalies, and opportunities for process improvement within administrative functions. Collaborate with department heads to understand reporting needs and deliver c…",,,2025-12-12T12:07:06Z,IT Jobs
Lead Gen AI Engineer [T500-22010],FM,"Bangalore, Karnataka","About FM: FM is a 190-year-old, Fortune 500 commercial property insurance company of 6,000 employees with a unique focus on science and risk engineering. Serving over a quarter of the Fortune 500 and major corporations globally, they deliver data-driven strategies that enhance resilience, ensure business continuity, and empower organizations to thrive. FM India located in Bengaluru is a strategic location for driving FM's global operational efficiency that allows them to leverage the country’s …",,,2025-12-25T13:40:49Z,IT Jobs
Sr Gen AI Engineer [T500-22009],FM,"Bangalore, Karnataka","About FM: FM is a 190-year-old, Fortune 500 commercial property insurance company of 6,000 employees with a unique focus on science and risk engineering. Serving over a quarter of the Fortune 500 and major corporations globally, they deliver data-driven strategies that enhance resilience, ensure business continuity, and empower organizations to thrive. FM India located in Bengaluru is a strategic location for driving FM's global operational efficiency that allows them to leverage the country’s …",,,2025-12-25T13:35:51Z,IT Jobs
"Software Engineer II, GPS Data Solutions",Bristol Myers Squibb,"Hyderabad, Telangana","Introduction to BMS Bristol-Myers Squibb is a global Biopharma company committed to a single mission: to discover, develop, and deliver innovative medicines focused on helping millions of patients around the world in disease areas such as oncology, cardiovascular, immunoscience and fibrosis. Join us and make a difference. We hire the best people and provide them with a work environment that places a premium on diversity, integrity, collaboration and personal development. Through a culture of in…",,,2025-04-11T09:33:55Z,IT Jobs
Senior Software Engineer - Data Engineer - Data & ML Engineering {AWS & Glue},Bristol Myers Squibb,"Hyderabad, Telangana","BMS Hyderabad is an integrated global hub where our work is focused on helping patients prevail over serious diseases by building sustainable and innovative solutions. This important science, technology, and innovation center will support a range of technology and drug development activities that will help user in the next wave of innovation. Position: Senior Software Engineer - Data Engineer - Data & ML Engineering Location: Hyderabad, India At Bristol Myers Squibb, we are inspired by a single…",,,2024-05-28T19:12:34Z,IT Jobs
AWS Database Administrator,TELUS Digital,"Noida, Ghaziabad","3 more years of experience in architecting, designing, developing, and implementing cloud solutions on AWS platforms Experience in using Terraform to provision AWS services and experience implementing IaaC Understanding of and experience with NiFi and Postgres installations on Prem and in cloud Experience in several of the following areas: database architecture, ETL, EKS, Gitlab Proven ability to collaborate with multidisciplinary teams of business analysts, developers, data scientists, and sub…",,,2025-12-19T08:55:12Z,IT Jobs
Data Analyst Associate - Data Management,Wissen Technology,"Mumbai, Maharashtra","Job Title: Data Analyst Associate – Data Management Location: Mumbai, India Company: Wissen Technology About Us: Wissen Technology is a leading technology and consulting firm known for its strong commitment to excellence, innovation, and customer satisfaction. We are passionate about harnessing data to drive smart business decisions and deliver impactful insights. Join us in shaping the future of data management. Role Overview: We are looking for a meticulous and proactive Data Analyst Associat…",,,2025-05-23T06:51:56Z,IT Jobs
Data Analyst and Data science trainer,EDU TECH,"Chavakkad, Thrissur","We are looking for a dynamic and skilled Data Science and Data Analyst Trainer with 2 to 5 years of hands-on industry and/or teaching experience. The ideal candidate should be able to simplify complex data concepts, mentor aspiring professionals, and deliver effective training programs in data analytics, data science, and business intelligence tools. Skills:- Tableau, Python, PowerBI, Machine Learning (ML), Artificial Intelligence (AI) and Deep Learning",200000.0,600000.0,2025-08-02T05:31:53Z,IT Jobs
Business Intelligence Developer,EXL,"Noida, Ghaziabad","Job Description: We are looking for a talented Tableau Developer to create dynamic, insightful, and intuitive visual reports using Tableau. The ideal candidate will work collaboratively with cross-functional teams to understand data requirements, develop customized reports, and ensure data accuracy and integrity. This role involves building data models and visualizations to help the organization analyze trends, patterns, and key performance indicators (KPIs). Key Responsibilities: Design, devel…",,,2025-12-03T09:03:56Z,IT Jobs
"Data Analyst, Risk Data Analytics",Standard Chartered India,"Chennai, Tamil Nadu","Key Responsibilities Proficiency in SQL is mandatory. Python, Tableau and other tools are a bonus Strong analytical mindset with excellent logical, reasoning, and problem-solving skills Understanding of Finance and risk concepts is desirable Understanding of data engineering concepts is desirable Skills And Experience SQL Python Tableau Qualifications Qualified to Bachelor / Masters Level in related subjects About Standard Chartered We're an international bank, nimble enough to act, big enough …",,,2025-12-18T03:57:11Z,IT Jobs
Senior Data Analyst - Data Engineering / Modeling,Exusia,"Baner, Pune","Department: Client Delivery Team - Empower Industry: Information Technology & Services, Computer Software, Management Consulting Location: Pune/Bangalore/Hyderabad/Remote (Anywhere in India) Experience Range : 5 years Basic Qualification: Master/Bachelor of Engineering or Equivalent Travel Requirements: Not required Website : www.exusia.com What’s the Role? Full-time job to work with Exusia's global (Americas, Europe, Africa, Asia) clients to deliver on bleeding-edge data-driven solutions by pe…",,,2025-12-21T16:44:42Z,IT Jobs
"PySpark_Hyderabad, chennai, Kolkata",Tata Consultancy Services,"Hyderabad, Telangana","Greetings from TCS TCS Hiring for PySpark Job Location: Chennai, Hyderabad, Kolkata Experience Range: 4-8 Years Job Description : • 5–6 years of total experience in data engineering or big data development. • 2–3 years hands-on experience with Apache Spark. • Strong programming skills in PySpark, Python, and Scala. • 2 years of experience in Scala backend development. • Proficient in Scala, both object oriented and functional programming concepts. • Deep understanding and application of advance…",,,2025-12-03T09:03:46Z,IT Jobs
Azure Data Engineer,Paritas Recruitment,India,"Azure Data Engineer - 6 Month Rolling Contract Market Day Rate on offer Remote - (Sunday to Thursday working days) Location: Remote - 1 Week per quarter in Qatar Paritas is working with a global IT Consultancy & leading Energy client who are seeking an experienced and highly skilled Azure Data Engineer to join their team who is responsible for data engineering, designing, developing, and maintaining the data platform and systems required for data storage, processing, and analysis. Responsibilit…",,,2025-12-05T01:32:29Z,IT Jobs
Global Process Excellence Expert,Nouryon,"Navi Mumbai, Maharashtra","At Nouryon, our global team of Changemakers takes positive action every day, to reach higher goals collectively and individually. We create innovative and sustainable solutions for our customers to answer society’s needs – today and in the future. Purpose/Key Objectives of the Job: We are seeking a skilled and proactive Global Process Excellent Expert / Data Analyst RTR to support our Global Process Improvement Manager and the international Finance Improvement team. This supporting role is esse…",,,2025-12-09T09:01:37Z,Accounting & Finance Jobs
Senior Data Engineer,Saras Analytics,"Hyderabad, Telangana","About Saras Analytics: We are an ecommerce focused end to end data analytics firm assisting enterprises & brands in data driven decision making to maximize business value. Our suite of work spans extraction, transformation, visualization & analysis of data delivered via industry leading products, solutions & services. Our flagship product is Daton, an ETL tool. We have now ventured into building exciting ease of use data visualization solutions on top of Daton. And lastly, we have a world class…",,,2025-12-12T09:50:38Z,IT Jobs
Technical Project Manager / Senior Impact Evaluation Specialist,EHI International Pvt. Ltd,"Chennai, Tamil Nadu","Job Title: Technical Project Manager / Senior Impact Evaluation Specialist Location: Chennai with frequent travel across rural Tamil Nadu Engagement: Full-time, project-based (multi-year) Project: External Monitoring & Evaluation Employer: Technical Facilitation Agency (EHI International) We are seeking a highly experienced Technical Project Manager to lead a multi-disciplinary team of international standing with extensive expertise in conducting M&E for large-scale Government and development p…",,,2025-12-12T09:53:03Z,Consultancy Jobs
Senior Data Engineering Manager [T500-21341],FM,"Bangalore, Karnataka","About us: We are a highly successful 190-year-old, Fortune 500 commercial property insurance company of 6,000 employees with a unique focus on science and risk engineering. Businesses worldwide trust our expertise to protect their assets, relying on our comprehensive risk assessments and robust, engineering-based insurance solutions to safeguard against fire, natural disasters, and other perils. Serving over a quarter of the Fortune 500 and major corporations globally, we deliver data-driven st…",,,2025-12-09T09:03:25Z,IT Jobs
Data Scientist (E-Commerce),Unotech Global,India,"The Opportunity: As an eCommerce Data Analyst , you'll have the opportunity to make a significant impact by providing actionable insights that drive business decisions. You are passionate about data, have mastered using it to take an advisory approach, and thrive in a business where the data you share helps support business objectives. You hold a strong understanding of data sources, their structures, how the data flows, and where improvements could be made. You'll work in a dynamic environment…",,,2025-10-15T17:15:05Z,IT Jobs
Manager - Data Analytics Tuning & Optimization,MUFG Global Service ,"Bangalore, Karnataka","About Us: MUFG Bank, Ltd. is Japans premier bank, with a global network spanning in more than 40 markets. Outside of Japan, the bank offers an extensive scope of commercial and investment banking products and services to businesses, governments, and individuals worldwide. MUFG Banks parent, Mitsubishi UFJ Financial Group, Inc. (MUFG) is one of the worlds leading financial groups. Headquartered in Tokyo and with over 360 years of history, the Group has about 120,000 employees and offers services…",,,2025-12-06T05:58:37Z,Accounting & Finance Jobs
Data Analyst / ML Engineer,Talent Pro,"Mumbai, Maharashtra","What You will do: ● Play the role of Data Analyst / ML Engineer ● Collection, cleanup, exploration and visualization of data ● Perform statistical analysis on data and build ML models ● Implement ML models using some of the popular ML algorithms ● Use Excel to perform analytics on large amounts of data ● Understand, model and build to bring actionable business intelligence out of data that is available in different formats ● Work with data engineers to design, build, test and monitor data pipel…",2000000.0,4000000.0,2025-04-25T04:45:08Z,IT Jobs
Senior Data Analyst- Payments,Cognizant,"Hyderabad, Telangana","NEW JD- Job Title: Senior Data Analyst- Payments We are looking for a highly skilled and detail-oriented Senior Data Analyst with a strong analytical mindset. This crucial role requires advanced SQL to transform raw data into actionable insights that support strategic decision-making. A deep understanding of business operations is essential. Location - Hyderabad and Gurgaon only. EXP - 6-8 YRS NP - Immediate - 30 Days Key Responsibilities:  Data Analysis & SQL Proficiency: Collect, clean, and a…",,,2025-12-25T12:17:21Z,IT Jobs
Sr. Data Analyst| Mumbai,CSB Bank,"Mumbai, Maharashtra","Description Design, develop, and maintain robust ETL pipelines to ingest data from various banking systems into analytics platforms. Build and optimize data models for reporting, analytics, and machine learning use cases. Collaborate with data analysts, data scientists, and business stakeholders to understand data requirements. Conduct in-depth data analysis to answer complex business questions, across Risk, credit and liabilities domain, delivering actionable insights for decision-making. Ensu…",,,2025-10-12T14:51:05Z,IT Jobs
Data Analyst (Central Room),Almighty HRD Consultants,"Chennai, Tamil Nadu","Hi, We are hiring for Data Analyst for our client, Jewel manufacturing industry in Chennai location Job Title: Data Analyst (Central Room) No of Openings 1 Reports to: Plant Head Reportees: 2 Gender Male Incentives Nil Qualification: Diploma, BE Experience Range: 2 to 3 Yrs Preferred Industry: Manufacturing Working Days 6 Days Working Hours 8 Hrs Languages Tamil ,English Location Preference: Chennai Job Role: Data is the fuel of industrial engineering. Candidates need to collect, analyze, and i…",360000.0,420000.0,2025-11-23T02:35:26Z,"Energy, Oil & Gas Jobs"
Open Position for Data Analyst,Cognizant,"Hyderabad, Telangana","Darta Analyst - 3-7 years EXP Job Title: Senior Data Analyst We are looking for a highly skilled and detail-oriented Senior Data Analyst with a strong analytical mindset. This crucial role requires advanced SQL to transform raw data into actionable insights that support strategic decision-making. A deep understanding of business operations is essential. Key Responsibilities:Data Analysis & SQL Proficiency: Collect, clean, and analyze datasets for trends; translate business needs into data solut…",,,2025-12-19T11:37:57Z,IT Jobs
Data Analyst-Retail Assets,IDFC FIRST Bank,"Mumbai, Maharashtra","Job Requirements Job Title: Data Analyst Function/Department : Data & Analytics Job Purpose The Data Analyst role identifies business needs and builds analytical tools and methods. Will also develop test strategies and will Ensure delivery outcomes for specific business asks on Data Analytics Job & Responsibilities Identify and scope business requirements and priorities through rigorous information gathering and analysis as well as clarification of the solutions, initiatives, and programmes to …",,,2025-12-19T03:55:19Z,IT Jobs
Data Analyst - Product Analytics,Colan Infotech Private Limited,"Chennai, Tamil Nadu","Role: Data Analyst - Product Analytics Job Description 4 years of experience in data analytics with at least 2 years in product analytics. * Proficiency in SQL and Python for data analysis; strong understanding of experimentation methods and causal inference. * Experience working with Azure Data Services and Databricks (or equivalent cloud-based platforms). * Expertise in building compelling, user-friendly dashboards in Power BI. * Strong communication skills and ability to influence cross-func…",,,2025-11-19T01:01:26Z,IT Jobs
Human Resource Data Analyst,JioStar,"Mumbai, Maharashtra","The Role: The Talent Acquisition Data Analyst is responsible for ensuring data driven process efficiency and decisioning in the Talent Acquisition function. This role works with internal recruiters, function head and business stakeholders to ensure decision-making is supported through relevant data dashboards and advanced reporting. What will you do? Partner with Head-Talent Acquisition, HR Business Partners and business stakeholders to develop BAU reports, data models and dashboards for recrui…",,,2025-12-04T22:44:42Z,HR & Recruitment Jobs
Reference Data Analyst BA,Citi,"Pune, Maharashtra",As a Data Analyst for the Securities Master Central SMC team your role involves performing data analysis for complex systems and front to back flows You will be responsible for reverse engineering functional specifications from data and collaborating closely with End Users Clients to understand Business Process Industry Standards and Regulatory Mandate requirements Working in coordination with IT and Operations partners you will also engage with external data vendors like Bloomberg Reuters IDC …,,,2025-11-12T22:17:14Z,IT Jobs
Data Analyst for Brake System,BMW TechWorks India,"Pune, Maharashtra","Role Data Analyst for Brake System Visit our website bmwtechworks.in to know more. Follow us on LinkedIn I Instagram I Facebook I X for the exciting updates. About the UNIT/ Unit Overview Digital Product Engineering Location Pune Experience: More than 5 years Number of openings 2 What awaits you/ Job Profile As a Data Analyst in the Brake System team, you will play a key role in analyzing crucial data gathered during vehicle development and from field usage. Your work will support the validatio…",,,2025-11-21T22:34:31Z,IT Jobs
Data Analyst - Email Marketing,QuinStreet,"Pune, Maharashtra",Powering Performance Marketplaces in Digital Media QuinStreet is a pioneer in powering decentralized online marketplaces that match searchers and “research and compare” consumers with brands . We run these virtual- and private-label marketplaces in one of the nation’s largest media networks. Our industry leading segmentation and AI-driven matching technologies help consumers find better solutions and brands faster. They allow brands to target and reach in-market customer prospects with pinpoint…,,,2025-10-26T15:08:40Z,IT Jobs
Compliance Learning Data Analyst,Philips,"Bangalore, Karnataka","Job Title Compliance Learning Data Analyst Job Description Job Title: Compliance Learning Data Analyst The Compliance Learning Analyst supports compliance training initiatives by assisting in the collection, organization, and basic analysis of training data. The role helps generate reports and visualizations to inform decision-making and contributes to the maintenance of compliance-related learning systems. This position operates under close supervision and follows established procedures to ens…",,,2025-12-17T20:01:05Z,IT Jobs
E- commerce Data Analyst,Qrata,"Bangalore, Karnataka","Roles & Responsibilities: Prepare and maintain E-commerce reports. Performing analysis to assess quality and meaning of data Preparing reports for the management stating trends, patterns, and predictions using relevant data Streamlining communication channels between Sales, Operations, Accounts and other teams. Build relationships with Marketplace Sellers/logistics partners/third party vendor/ payment gateways. Assigning numerical value to essential business functions so that business performan…",500000.0,800000.0,2024-01-07T15:08:03Z,IT Jobs
Data Analyst - wholesale banking,Asterion,India,Job Title – Data Analyst Place of work - Mumbai Business Unit – Data & Analytics Function - COO Job Purpose : Own specific work streams within the context of a larger projects Manage internal processes necessary for successful project implementation Perform research needed to execute projects Document project activities to adhere to controls processes Work with cross functional stakeholders to increase adoption of analytics in decision making Independently execute projects Roles & Responsibilit…,,,2025-05-26T02:02:33Z,Consultancy Jobs
Data Analyst(AI-LLM),RingCentral,"Bangalore, Karnataka","Say hello to possibilities. It’s not everyday that you consider starting a new career challenge. We’re RingCentral, a global leader in cloud-based communications and collaboration software. We are fundamentally changing the nature of human interaction—giving people the freedom to connect powerfully and personally from anywhere, at any time, on any device. We’re a $2 billion company that’s growing at 30% annually and we’re expanding our Solutions Engineering Team to make sure we stay ahead of th…",,,2024-07-31T03:03:11Z,IT Jobs
Senior Digital and Data analyst,Kenvue,India,"Kenvue is currently recruiting for a: Senior Digital and Data analyst What we do At Kenvue , we realize the extraordinary power of everyday care. Built on over a century of heritage and rooted in science, we’re the house of iconic brands - including NEUTROGENA®, AVEENO®, TYLENOL®, LISTERINE®, JOHNSON’S® and BAND-AID® that you already know and love. Science is our passion; care is our talent. Who We Are Our global team is ~ 22,000 brilliant people with a workplace culture where every voice matte…",,,2025-10-31T15:05:28Z,IT Jobs
Financial Data Analyst Manager,Stripe,"Bangalore, Karnataka","Who we are About Stripe Stripe is a financial infrastructure platform for businesses. Millions of companies—from the world's largest enterprises to the most ambitious startups—use Stripe to accept payments, grow their revenue, and accelerate new business opportunities. Our mission is to increase the GDP of the internet, and we have a staggering amount of work ahead. That means you have an unprecedented opportunity to put the global economy within everyone's reach while doing the most important …",,,2025-11-19T22:18:54Z,IT Jobs
Product Marketing Data Analyst,Danaher,India,"Find what drives you on a team with a more than 75-year history of discovery, determination, and innovation. As a global leader in high-tech filtration, separation, and purification, Pall Corporation thrives on helping our customers solve their toughest challenges. Our products serve diverse, global customer needs across a wide range of applications to advance health, safety and environmentally responsible technologies. For the exponentially curious, Pall is a place you can thrive and amplify y…",,,2025-12-27T00:53:04Z,IT Jobs
Product Marketing Data Analyst,Danaher Corporation,"Maharashtra, India","Find what drives you on a team with a more than 75-year history of discovery, determination, and innovation. As a global leader in high-tech filtration, separation, and purification, Pall Corporation thrives on helping our customers solve their toughest challenges. Our products serve diverse, global customer needs across a wide range of applications to advance health, safety and environmentally responsible technologies. For the exponentially curious, Pall is a place you can thrive and amplify y…",,,2025-12-25T12:17:38Z,IT Jobs
Data Analyst- Building Materials,The Search House,"Bangalore, Karnataka","Job Roles and Responsibilities: Update all details of the contact on Rolo CRM. Handle all activities on internal Rolo CRM . ⁠Develop complete understanding of Rolo CRM. Check each team member daily engagement on Rolo CRM. Create detailed reports, including brand performance reports and team reports, using Excel (pivot tables, charts, and formulas). Develop dynamic dashboards to track KPIs, CRM updates, and key business metrics. Analyze and provide insights from meeting feedback to improve strat…",,,2025-06-14T02:58:20Z,IT Jobs
Senior Technical Data Analyst,Clearwater Analytics,"Noida, Ghaziabad","Job Summary: The Technical Data Analyst is responsible for maintaining investment data for clients. This role involves tasks such as analyzing and organizing raw data, building data systems and pipelines, conducting complex data analysis, and presenting information through data visualization techniques. Additionally, the analyst collaborates with clients and project management teams to grasp customer and company needs. This role requires the ability to merge data from various sources and presen…",,,2025-11-18T22:17:48Z,IT Jobs
