title,company,location,description,salary_min,salary_max,created,category
Lead Business Analyst,Tata Consultancy Services,"Chennai, Tamil Nadu","Role Overview We are seeking a Lead Business Analyst to manage a small team and drive requirements for a next-generation low latency, real-time (streaming) market data platform. This role combines leadership with hands-on analysis and close collaboration with global stakeholders. Key Responsibilities • Lead and mentor a team of Streaming Market Data Business Analysts, ensuring high-quality deliverables • Define and maintain standards for requirements documentation and analysis • Own the require…",,,2025-12-11T09:27:03Z,IT Jobs
Computer Science & Mathematics Specialist,Shiv Nadar School,"Noida, Ghaziabad","Designation / Role - Computer Science and Mathematics Specialist Location : Noida THE POSITION The Computer Science and Mathematics Specialist will design and drive advanced, future-ready curricula that integrate Mathematics, Science, Computational Thinking, Artificial Intelligence, and Generative AI across grade levels. This role is responsible for embedding deep conceptual math and science learning with coding, AI literacy, robotics, web/app development, and real-world problem solving, while …",,,2025-12-13T09:40:03Z,IT Jobs
Capital Time Tracking Specialist [T500-21552],Inspire,"Hyderabad, Telangana","About Inspire Brands: Inspire Brands is disrupting the restaurant industry through digital transformation and operational efficiencies. The company’s technology hub, Inspire Brands Hyderabad Support Center, India, will lead technology innovation and product development for the organization and its portfolio of distinct brands. The Inspire Brands Hyderabad Support Center will focus on developing new capabilities in data science, data analytics, eCommerce, automation, cloud computing, and informa…",,,2025-11-25T08:53:51Z,IT Jobs
Supply Chain Data Architect,Olympus Corporation,"Bangalore, Karnataka","About Us We at Olympus are an equal opportunities employer and we are committed to ensuring that no applicant or employee receives less favorable treatment on the grounds of gender, age, disability, religion, belief, sexual orientation, marital status, or race, or is disadvantaged by conditions or requirements which cannot be shown. About the Role Global Supply Chains are rapidly evolving and to remain competitive Olympus must innovate and digitalize its internal processes. As a Supply Chain Da…",,,2025-12-10T16:54:06Z,IT Jobs
Sr Manager - MIS & Data Analytics,IGT Solutions,India,"IGT Solutions (IGT) is committed to simplifying complex customer interactions while delivering a seamless experience. IGT provides integrated BPM, Technology and Digital Services & Solutions for clients across industries. IGT Solutions is a next-gen customer experience (CX) company, defining and delivering transformative experiences for the global and most innovative brands using digital technologies. With the combination of Digital and Human Intelligence, IGT becomes the preferred partner for …",,,2025-12-10T16:48:58Z,IT Jobs
FinOps Analyst,Zapcom Group Inc,"Bangalore, Karnataka","Job Description Cloud Cost Analysis and Optimization : Monitor and analyse cloud usage and spending across platforms (e.g., AWS, Azure, Google Cloud) to identify inefficiencies, recommend optimizations, and implement strategies for cost savings tailored to research workloads, such as variable compute demands in data-intensive projects. Bridging Finance and Engineering : Collaborate organization-wide to align cloud strategies with financial goals, promote FinOps principles, guide teams to archit…",,,2025-12-26T08:35:16Z,IT Jobs
Head – Marketing Analytics & Insights,GITAM Deemed University,"Bangalore, Karnataka","Job Title: Head – Marketing Analytics & Insights Location: Bangalore / Hyderabad/Vizag Employment Type: Full-Time Role Summary The Head – Marketing Analytics & Insights will be responsible for turning data into actionable strategic insights that drive marketing performance, customer acquisition, retention, and ROI. This leader will build and manage a high-performing analytics team, establish the measurement infrastructure and frameworks, and partner closely with marketing and admissions teams t…",,,2025-12-11T09:25:48Z,IT Jobs
Data Analyst (InvoiceMart),Antal International,"Mumbai, Maharashtra","Data Analyst Location –Mumbai Experience – 4 to 7 years Work Model – 5 Days working, with alternate Saturdays working Notice Period - Immediate to 15 days Key Skills – Data Analyst, Data Modelling, SQL, Credit Analyst, Predictive Modelling. Job Description: We are looking for talented Data Analyst who can work with Stakeholders and solve business problems. Required Skills & Experience: Work with stakeholders throughout the organization to identify opportunities for leveraging company data to dr…",,,2025-12-16T05:51:00Z,IT Jobs
Data Analyst Lead,Virtusa,India,"Role\: Highly skilled and experienced Data Analyst Lead with a strong analytical mindset, exceptional proficiency in data manipulation and visualization tools, and a proven track record of leading and mentoring a team of data analysts. Key Responsibilities:Lead and manage a team of data analysts, providing guidance, mentorship, and technical support.Oversee the end-to-end data analysis process, from data extraction and cleaning to interpretation and reporting.Develop and maintain robust data mo…",,,2025-11-28T22:49:27Z,IT Jobs
Data Analyst Trainee,Lead India,"Bangalore, Karnataka","Job Description: Data Analyst Lead India is looking for dynamic data analysts who has passion for data and a relentless focus on execution and delivery. The candidate is expected to come up with insightful data presentation to make informed decisions. As a data analyst your roles and responsibilities will be as follows: Experience: 0-1 years Technical Skills: Strong Work experience on Azure (App Insights, Stream analytics, Data Factory, Data warehouse, Azure Storage accounts, Blobs) Strong anal…",,,2024-07-31T03:13:42Z,IT Jobs
Data Analyst II,MiQ Digital,"Bangalore, Karnataka","Role: Data Analyst II - PDS Location: Bengaluru What you’ll do We’re MiQ, a global programmatic media partner for marketers and agencies. Our people are at the heart of everything we do, so you will be too. No matter the role or the location, we’re all united in the vision to lead the programmatic industry and make it better. As a Data Analyst II in our data science department, you’ll have the chance to: Be a part of execution of Data science projects and a key player in promoting data assets a…",,,2025-10-15T14:56:09Z,IT Jobs
Data Analyst Intern,Optimspace,"Pune, Maharashtra","Job Title: Data Analyst Intern Company: Optimspace.in Location: Remote Duration: 3 months Opportunity: Full-time based on performance, with a Certificate of Internship Optimspace.in Optimspace.in offers practical experience for students and graduates in data analysis to enhance career prospects and provide hands-on learning opportunities in a real-world environment. Responsibilities Collect, clean, and analyze datasets. Develop reports and data visualizations. Identify trends and patterns in da…",,,2025-11-20T00:58:19Z,IT Jobs
Vacancy For Data Analyst,DEVIKA STAFFING SOLUTION,India,We are looking to hire a data analyst to join our data team You will take responsibility for managing our master data set developing reports and troubleshooting data issues To do well in this role you need a very fine eye for detail experience as a data analyst and a deep understanding of the popular data analysis tools and databases Responsibilities Managing master data including creation updates and deletion Managing users and user roles Provide quality assurance of imported data working with…,,,2025-11-29T01:07:08Z,IT Jobs
Sr. Data Analyst,Multi Recruit,"Bangalore, Karnataka","Managing and designing the reporting environment, including data sources, security, and metadata. Preparing reports for executive leadership that effectively communicate trends, patterns, and predictions using relevant data Establish KPIs to measure the effectiveness of business decisions. Work with management to prioritize business and information needs. Provide data solutions, tools, and capabilities to enable self-service frameworks for data consumers Provide expertise and translate the busi…",600000.0,1500000.0,2022-01-30T04:34:29Z,IT Jobs
Senior Data Analyst,Capco,India,"Job Title: Senior Data Analyst - Global Trading System About Us “Capco, a Wipro company, is a global technology and management consulting firm. Awarded with Consultancy of the year in the British Bank Award and has been ranked Top 100 Best Companies for Women in India 2022 by Avtar & Seramount . With our presence across 32 cities across globe, we support 100 clients across banking, financial and Energy sectors. We are recognized for our deep transformation execution and delivery. WHY JOIN CAPCO…",,,2025-12-12T00:34:22Z,IT Jobs
Hiring For Data Analyst,DEVIKA STAFFING SOLUTION,India,A Data Analyst analyses the companys raw data and develops methods to make it easier for other people to comprehend see trends or predict future events Data Analysts assist organisations in converting unwieldy quantities of data into something useful Responsibilities Creating an information architecture for a data set and ensuring that it is readily accessible and understandable to all users Make recommendations on how the organisation may best utilise the data they currently have to their adva…,,,2025-11-05T22:03:00Z,IT Jobs
Data Analyst Recruitment,DEVIKA STAFFING SOLUTION,India,A Data Analyst looks at the organisations raw data and finds ways to make it easier for others to understand see trends or predict what might happen in the future Data Analysts help businesses turn extensive unorganised collections of information into something useful Responsibilities Creating an information architecture for a data set and ensuring it is easily accessible and understandable to everyone Making recommendations on how the organisation can best use the data they have collected to t…,,,2025-11-13T22:22:41Z,IT Jobs
Sr Data Analyst,Jobizo,India,"About the Role: We are looking for a skilled and detail-oriented Data Analyst to join our team. The ideal candidate will be responsible for collecting, analyzing, and interpreting large datasets to support data-driven decision-making across the organization. Proficiency in MongoDB and SQL is essential for this role. Key Responsibilities: Collect, process, and clean structured and unstructured data from various sources. Analyze data using SQL queries and MongoDB aggregations to extract insights.…",700000.0,1000000.0,2025-06-19T05:22:26Z,IT Jobs
Opening for Data Analyst,DEVIKA STAFFING SOLUTION,India,We are seeking a talented and detailoriented Data Analyst to join our dynamic team As a Data Analyst you will be responsible for interpreting data analyzing results and providing actionable insights to drive informed decisionmaking across the agency You will work closely with stakeholders to understand their data needs develop analytical solutions and present findings in a clear and concise manner Responsibilities Create visually appealing and interactive dashboards reports and presentations Co…,,,2025-11-22T01:26:31Z,IT Jobs
Data Analyst Intern,Innovexis,India,"Description Innovexis is excited to announce an opening for a Data Analyst Intern to join our team in Bengaluru. This on-site internship offers a unique opportunity for aspiring data professionals to gain hands-on experience in the Education Management industry, contributing to data-driven decision-making and insights that enhance our educational offerings. As a Data Analyst Intern, you will be involved in collecting, analyzing, and interpreting data to support various projects within the organ…",,,2025-12-17T11:17:05Z,IT Jobs
Senior Data Analyst,Avantor,"Coimbatore, Tamil Nadu",Role Overview You will be working as a Senior Data Analyst leveraging advanced statistical methods and descriptive analytical techniques to analyze complex datasets generate insights and solve business problems Your responsibilities will include designing developing and deploying data transformation components orchestration pipelines and data visualization dashboards Collaboration with stakeholders to ensure the data strategy aligns with business objectives will also be a key aspect of your rol…,,,2025-10-29T02:21:45Z,IT Jobs
Senior Data Analyst,Capco,India,"Job Title: Data Analyst (Python Pyspark) About Us “Capco, a Wipro company, is a global technology and management consulting firm. Awarded with Consultancy of the year in the British Bank Award and has been ranked Top 100 Best Companies for Women in India 2022 by Avtar & Seramount . With our presence across 32 cities across globe, we support 100 clients across banking, financial and Energy sectors. We are recognized for our deep transformation execution and delivery. WHY JOIN CAPCO? You will wor…",,,2025-11-23T22:27:37Z,IT Jobs
Data Analyst Intern,Zeno Talent,India,"Location: Remote (Bangalore, India) Stipend: Performance-Based (Up to ₹15,000) Duration: 6 Months Mode: Remote Immediate Joining: Yes Preferred Candidates: Freshers, Pre-Final Year Students, Final Year Students, Recent Graduates About Zeno Talent Zeno Talent is a dynamic IT services and consulting company committed to empowering future professionals with practical, industry-relevant skills. Our 6-month Data Analyst Internship Program offers hands-on experience with real-world datasets, business…",,,2025-12-17T20:01:28Z,IT Jobs
Senior Data Analyst,ECONNECT SOLUTIONS PRIVATE LIMITED,"Mohali, Punjab",Pen Picture of Candidate We are seeking a highly skilled and analytical Senior Data Analyst to transform data into actionable insights that support business decisions product improvements and strategic planning Job Profile Location Mohali Qualification BE B Tech MCA Any recognized certification in data analyst is mandatory Min Experience in Yrs 5 Punjabi Language is must Role Responsibility Create detailed reports dashboards and visualizations that present complex data insights in an easytounde…,,,2025-12-01T01:04:40Z,IT Jobs
SAP Data Analyst,Rockwell Automation,India,"Rockwell Automation is a global technology leader focused on helping the world’s manufacturers be more productive, sustainable, and agile. With more than 28,000 employees who make the world better every day, we know we have something special. Behind our customers - amazing companies that help feed the world, provide life-saving medicine on a global scale, and focus on clean water and green mobility - our people are energized problem solvers that take pride in how the work we do changes the worl…",,,2025-10-17T15:06:33Z,IT Jobs
Senior Data Analyst,NeoGenCode Technologies Pvt Ltd,"Bangalore, Karnataka","Position : Senior Data Analyst Experience Required : 5 to 8 Years Location : Hyderabad or Bangalore (Work Mode: Hybrid – 3 Days WFO) Shift Timing : 11:00 AM – 8:00 PM IST Notice Period : Immediate Joiners Only Job Summary : We are seeking a highly analytical and experienced Senior Data Analyst to lead complex data-driven initiatives that influence key business decisions. The ideal candidate will have a strong foundation in data analytics, cloud platforms, and BI tools, along with the ability to…",1000000.0,1800000.0,2025-06-18T05:21:07Z,IT Jobs
Data Analyst - HYD,CoffeeBeans,"Hyderabad, Telangana","Role: Data Analyst Experience: 6 - 9 Years Location: Hyderabad WorkMode: Work from Office (5 Days) Overview We are seeking a highly skilled Data Analyst with 6 years of experience in analytics, data modeling, and advanced SQL. The ideal candidate has strong expertise in building scalable data models using dbt, writing efficient Python scripts, and delivering high-quality insights that support data-driven decision-making. Key Responsibilities Design, develop, and maintain data models using dbt (…",,,2025-12-09T00:53:36Z,IT Jobs
Senior Data Analyst,r3 Consultant,"Pune, Maharashtra","Description R3 Consultant is looking for a Senior Data Analyst to join our team in Pune. This full-time, on-site position offers an exciting opportunity to delve into data analytics within the staffing and recruiting industry, where your insights will drive strategic decision-making. As a Senior Data Analyst, you will play a pivotal role in analyzing complex datasets to identify trends, patterns, and insights that will enhance our recruitment strategies and improve client outcomes. You will col…",,,2025-12-16T02:52:13Z,IT Jobs
Lead Data Analyst,Job Connect India,"Mumbai, Maharashtra","Lead Data Analyst SUMMARY : The Data Systems Analyst is responsible for coordinating with business platform stakeholders to document clear and actionable requirements for data solutions. This role is the key link between business needs and the technical data designs to meet these needs. A good Data Systems Analyst is skilled at listening deeply to understand core needs and business processes and translatethem into the language of data, including data elements and data quality rules. Experience …",2000000.0,4000000.0,2025-05-04T01:41:01Z,IT Jobs
Lead Data Analyst,Job Connect India,"Mumbai, Maharashtra","Lead Data Analyst SUMMARY : The Data Systems Analyst is responsible for coordinating with business platform stakeholders to document clear and actionable requirements for data solutions. This role is the key link between business needs and the technical data designs to meet these needs. A good Data Systems Analyst is skilled at listening deeply to understand core needs and business processes and translatethem into the language of data, including data elements and data quality rules. Experience …",,,2025-11-04T21:39:29Z,IT Jobs
Mirai- Data Analyst,Unilever,"Bangalore, Karnataka","Job Title: Data Analyst Location: Bangalore ABOUT UNILEVER: Be part of the world's most successful, purpose-led business. Work with brands that are well-loved around the world, that improve the lives of our consumers and the communities around us. We promote innovation, big and small, to make our business win and grow; and we believe in business as a force for good. Unleash your curiosity, challenge ideas and disrupt processes; use your energy to make this happen. Our brilliant business leaders…",,,2025-12-19T11:39:47Z,IT Jobs
Maintenance Data Analyst,Praxien Technologies,"Vadodara, Gujarat","Position Title: Maintenance Data Analyst Experience : 2 to 5 Years Qualification: Diploma or Degree in Mechanical or Instrumentation Engineering Location: Vadodara Job Description: Understanding technical details about mechanical and instrumentation equipment such as pumps, compressors, turbines, heat exchangers, valves, gearboxes, and various field instruments. Experience of plant maintenance/shutdown/breakdown Activities Interpret and work with technical documentation including P&IDs SLDs Iso…",200000.0,500000.0,2025-07-20T02:32:13Z,Engineering Jobs
Business Data Analyst,Onclusive,"Trombay, Mumbai","Job Description We are seeking for a Business Data Analyst with both Data Analysis and Business Analysis skills to support our cross-functional teams in delivering data-driven solutions. The ideal candidate will have a balanced skill set in Data Analysis (SQL, Excel) and business analysis (Requirements gathering, process mapping, problem solving etc.), working with business stakeholders from all levels and functions to ensure successful deliveries. Key Responsibilities Collaborate with business…",,,2025-09-24T15:32:45Z,IT Jobs
Senior Data Analyst,Sigmoid,"Bangalore, Karnataka","Sigmoid Analytics is a leading Data solutions company backed by Sequoia Capital. We o ﬀ er best in- end-to-end data value chain spanning across Data Science, Data Engineering and Data Ops. With data and technology at the core of our solutions, we are solving some of the toughest problems out there. Our culture is modelled around expertise and mutual respect with a team first mindset. You’ll work with teams that push the boundaries of what-is-possible and build solutions that energize and inspir…",,,2025-08-23T17:16:10Z,IT Jobs
Senior Data Analyst,Luxoft,"Mumbai, Maharashtra","Job Description Project description Luxoft DXC Technology Company is an established company focusing on consulting and implementation of complex projects in the financial industry. At the interface been technology and business, we convince with our know-how, well-founded methodology and pleasure in success. As a reliable partner to our renowned customers, we support them in planning, designing and implementing the desired innovations. Together with the customer, we deliver top performance! For …",,,2025-11-30T01:00:50Z,IT Jobs
Lead - Data Analyst,Fidelity International,India,"About the Opportunity Job Type: Permanent Application Deadline: 17 December 2025 Job Description Title Lead - Data Analyst Department Technology Location Bangalore (hybrid / flexible working permitted) Reports To Middle and Back Office Data Analyst - Manager / Sr. Manager Level Business Analyst - 4 Fidelity International offers world class investment solutions and retirement expertise. As a privately owned, independent company, investment is our only business. We are driven by the needs of our …",,,2025-12-12T00:18:28Z,IT Jobs
Lead Data Analyst,Ipsos,"Bangalore, Karnataka","Description Analytics Team Lead Location: Bangalore Division: Ipsos Healthcare Ipsos is one of the world's largest research companies and currently the only one primarily managed by researchers, ranking as a 1 full-service research organization for four consecutive years. With over 75 different data-driven solutions, and presence in 90 markets, Ipsos brings together research, implementation, methodological, and subject-matter experts from around the world, combining thematic and technical exper…",,,2024-07-31T03:21:15Z,IT Jobs
Senior Data Analyst,PVH,India,"Design Your Future at PVH Senior Data Analyst POSITION TITLE: Senior Data Analyst (Business Analytics) – PVH Supply Data & Analytics DEPT. /DIVISION: Corporate Supply Data & Analytics POSITION REPORTS TO: Senior Manager, Data & Analytics LOCATION: Bangalore, India POSITION SUMMARY: The Supply Chain Data & Analytics (SDA) team sits within the corporate Supply Chain function at PVH and is passionate about powering a world-class, data-driven Supply Chain by delivering exceptional data & analytics,…",,,2024-08-19T03:31:25Z,IT Jobs
"Data Analyst, Mumbai",Puma Energy,India,"Main Purpose: Main Purpose We are looking for a Business Analyst (Data Analyst) with strong hands-on knowledge on SQL who must be familiar with energy segment and should be able to analyse data, processes, and support within a company to help improve efficiency and make strategic decisions. You will be part of a team with the goal of streamlining processes across the organisation globally. Strong analytical skills, attention to detail, and the ability to communicate effectively Be a trusted and…",,,2025-05-03T01:49:42Z,IT Jobs
Senior Data Analyst,Johnson Controls,"Pune, Maharashtra","Job Title: Senior Data Analyst Overview Data Analyst at Johnson Controls, you will be at the forefront of data-driven decision-making within the organization. Leveraging your analytical skills and expertise in data management, you will transform complex data into clear insights that drive business strategy and operational efficiency. Your role will involve collaborating with cross-functional teams to enhance data availability, quality, and insight generation, ultimately supporting the company’s…",,,2025-12-04T22:46:53Z,IT Jobs
Surveillance Data Analyst,Ogi Technologies Pvt Ltd,"Bangalore, Karnataka","Job Title: Surveillance Data Analyst Company: OGI Technologies Pvt Ltd. Location: Bangalore Company Overview: OGI Technologies is a global leader in IT management and consultancy services, empowering businesses of all sizes from start-ups to Fortune 100 companies with innovative solutions. With over 10 years of excellence, OGI Technologies has driven technological innovation and strategic growth for clients worldwide, supported by a dedicated team across operation centres in New York, India, an…",,,2025-11-26T01:26:52Z,IT Jobs
Lead Data Analyst,Clarivate,India,"We are looking for a Data Analyst to join our Content Operations Team. This is an exciting opportunity to be part of a high-impact team that shapes the quality and structure of content powering our customer-facing platforms. You’ll play a critical role in identifying, evaluating, and onboarding external content sources into our systems, as well as continuously improving the structure, completeness, and relevance of existing content. Your work will ensure we deliver accurate, timely, and high-va…",,,2025-09-12T23:19:57Z,IT Jobs
Data Analyst (SQL),Merito,"Mumbai, Maharashtra","About us :- Merito is a curated talent platform where we identify, assess, and connect candidates for matching job opportunities. We are working with the mission to change the way hiring is done. The company is founded by a team of alumni from IIM Ahmedabad, McKinsey with more than 2 decades of experience in recruitment, training, and coaching. About our Client :- Our client is an InsureTech platform backed by a major retail giant that offers contextual insurance in a blink. We are a team of co…",600000.0,800000.0,2023-10-22T13:49:04Z,IT Jobs
