title,company,location,description,salary_min,salary_max,created,category
Data Analyst,blinkdigital,India,"We are looking for a Data Analyst to join our Media team. In this role, you will be responsible for analyzing media performance data, deriving insights, and providing actionable recommendations to optimize campaigns and content strategies. You’ll work closely with the marketing, social media, and creative teams to ensure data-driven decisions that maximize reach, engagement, and ROI. Here’s what you should know if you want to be an Data Analyst at Blink: On any given day you might ● Collect, cl…",700000.0,800000.0,2025-11-15T23:37:07Z,"PR, Advertising & Marketing Jobs"
Data Analyst,Cloudester Software LLP,"Sevasi, Vadodara","We are looking for a detail-oriented Data Analyst with strong analytical skills and hands-on experience in SQL and Excel . The ideal candidate will be able to interpret data, generate insights, and support decision-making across functions. Knowledge of Python will be considered an added advantage. Key Responsibilities Extract, clean, and analyze data using SQL and advanced Excel functions . Prepare dashboards, reports, and data visualizations for business teams. Identify trends, patterns, and i…",,,2025-12-03T20:25:53Z,IT Jobs
Data Analyst,,"Thiruvananthapuram, Kerala",Immediate requirement for the post of Data Analyst on rotation Shift (Male or Female). Persons only willing to work in both shifts need to apply.careers.coretechgmail.comorplease contact 9.4.nine.6.8.1.5.6.3.0,,,2024-05-10T07:38:46Z,IT Jobs
Data Analyst,Openprise,"Kanchanbagh, Hyderabad","Title: Data Analyst Experience: 2-4 years Location: Hyderabad Notice Period: 0-1 Month Job Description Openprise is looking for an enthusiastic, talented individual to join its Product Management team! As a Data Analyst, you will assist the team with analyzing data files from our data partners which includes people and company data. You will also help find and maintain sources of open data, which are public data that are difficult for systems to access. These various data are critical in suppor…",,,2025-09-26T17:23:34Z,IT Jobs
Data Analyst,Innoventrics,"Noida, Ghaziabad","Data Analyst About the opportunity A fast-growing technology company operating in the enterprise SaaS and digital identity/transaction-security analytics sector. The team builds scalable analytics platforms that turn high-volume transaction and telemetry data into actionable product, risk, and operational insights. This is a hybrid role based in India, collaborating closely with product, engineering, and business stakeholders. Role & Responsibilities Author, optimize, and maintain complex SQL q…",420000.0,720000.0,2025-12-21T05:27:14Z,IT Jobs
Data Analyst,Keywords Studios,India,"We are on a mission to rid the world of bad customer service by “mobilizing” the way help is delivered. Today’s consumers want an always-available customer service experience that leaves them feeling valued and respected. Helpshift helps B2B brands deliver this modern customer service experience through a mobile-first approach that changes how conversations occur, moving the conversation away from slow, outdated email and desktop experience to an in-app chat experience that allows users to inte…",,,2025-09-30T18:39:43Z,IT Jobs
Data Analyst,Fusemachines,"Pune, Maharashtra","About Fusemachines Fusemachines is a 10 year old AI company, dedicated to delivering state-of-the-art AI products and solutions to a diverse range of industries. Founded by Sameer Maskey, Ph.D., an Adjunct Associate Professor at Columbia University, our company is on a steadfast mission to democratize AI and harness the power of global AI talent from underserved communities. With a robust presence in four countries and a dedicated team of over 400 full-time employees, we are committed to foster…",,,2025-11-11T20:13:53Z,IT Jobs
Data Analyst,Scout Incorporation,"Pune, Maharashtra","We are looking for Data Analysts . Salary : INR 5,00,000 / year Responsibility: Data Analysis & Insights: Derive actionable insights from various reports to support and accelerate business growth initiatives. Customer Data Analysis: Conduct detailed analysis of historical customer data to identify trends, patterns, and opportunities for enhancing customer experience and business performance. Cross-functional Collaboration: Collaborate closely with the Head of Growth Marketing and other relevant…",500000.0,500000.0,2025-12-25T03:08:52Z,IT Jobs
Data Analyst,Community Empowerment Lab,"Bakshi Ka Talab, Lucknow","Data Analyst Full-time | Mission-driven | High-impact – 2 Positions Do you believe that numbers can save lives, and want to turn data into real-world impact? About CEL Community Empowerment Lab (CEL) is a globally recognised institution working to transform maternal and newborn health by uniting science with compassion. Our research-to scale pipeline powers India’s efforts toward single-digit neonatal mortality by 2030. The Data Analytics & Decision Science Unit serves as the central nervous sy…",,,2025-12-13T08:22:50Z,Scientific & QA Jobs
Data Analyst,The Future University,"Chandigarh, India","About the Opportunity Join a dynamic leader in the education sector that leverages advanced data analytics to drive institutional excellence. Operating in a technology-driven environment, this high-growth organization empowers its teams with a comprehensive data strategy. As a critical part of the on-site team based in India, you will help transform data into actionable insights that support strategic decision-making. Role & Responsibilities Develop, optimize, and maintain complex SQL queries t…",600000.0,1000000.0,2025-12-11T03:05:50Z,IT Jobs
Data Analyst,Antarctica,India,"Antarctica is a Mumbai-based climate technology company with clients across the globe. We build software products that change people’s lives and make the world a better place. Our flagship product is the world’s most advanced observability ecosystem , that provides real-time insights into IT operations and enables organizations to optimize costs, reduce carbon emissions, and ensure regulatory compliance. It is a fundamental shift in how companies measure, act on, and lead their digital transfor…",,,2024-08-06T12:36:55Z,IT Jobs
Data Analyst,Talent Worx,India,"Position Name: Excel & SQL Expert Location: Bangalore Experience: 4-6 years Working Mode: Work from Office needs a bachelor’s degree and 2-4 years of exp. Key skills include proficiency with SQL for data management, advanced Excel (including VBA/Macros), strong analytical and problem-solving abilities. Bachelor's Degree: A minimum of 2-4 years of relevant experience is often required. Microsoft Excel: Advanced skills in Excel, including VBA and Macros. SQL: Proficiency in SQL is crucial for man…",,,2025-09-22T18:21:21Z,IT Jobs
Data Analyst,Acme Services Private Limited,India,"Job Description: Library Maintenance & Development: Maintain, improve, and extend existing Python data libraries, with a primary focus on Pandas for data manipulation and analysis. Product Development Support: Assist in the development of new data products and features by providing robust, reusable data processing components. Data Analysis & Debugging: Analyze and debug data-related issues within the libraries, ensuring accuracy and performance in data processing workflows. Team Support: Suppor…",1900000.0,2000000.0,2025-12-23T06:43:38Z,IT Jobs
Data Analyst,Acme Services Private Limited,"Yerwada, Pune","Job Description: 2 years of experience with SQL, including writing complex queries and joins. Hands-on experience with MS Excel (VLOOKUP, Pivot Tables, Data Validation, etc.). Working knowledge of Python for data analysis and automation is a plus. Working knowledge of Git for version control. Experience in complex joins and data transformations across multiple tables. Ability to generate and automate reports based on operational requirements. Knowledge of payment gateways, banking systems, or r…",1100000.0,1200000.0,2025-12-27T07:41:57Z,IT Jobs
Data analyst,Yubi Group,"Tondiarpet Fort St George, Chennai","Yubi, formerly known as CredAvenue, is re-defining global debt markets by freeing the flow of finance between borrowers, lenders, and investors. We are the world's possibility platform for the discovery, investment, fulfillment, and collection of any debt solution. At Yubi, opportunities are plenty and we equip you with tools to seize it. In March 2022, we became India's fastest fintech and most impactful startup to join the unicorn club with a Series B fundraising round of $137 million. In 202…",,,2025-12-16T06:12:29Z,Accounting & Finance Jobs
Data Analyst,M3USA,"Bangalore, Karnataka","Job Description Essential Duties and Responsibilities Including, but not limited to the following: Support the day-to-day data needs of internal clients by: Clarifying requests as needed Preparing the data Performing list matches using a mixture of in house developed tools and MS Excel Reporting upon the results Work directly with internal clients on the above",,,2025-12-18T20:22:50Z,Social work Jobs
Data Analyst,Sia,"Mumbai, Maharashtra","Job Description We are hiring a Power BI Developer to support our global internal teams (Finance, HR, Strategy, Corporate Functions) by delivering high-impact business intelligence dashboards, datasets, and analytics solutions. This role is critical for strengthening our internal reporting systems and driving data-backed decision-making across the organization. Key Responsibilities Design, maintain, and enhance internal Power BI dashboards and analytics for Corporate Finance and other functions…",,,2025-12-08T21:32:21Z,IT Jobs
Aws data engineer,JRD Systems,"Bangalore, Karnataka","Responsibilities: Design, develop, and maintain scalable data pipelines including complex algorithms Ensure data quality and integrity through robust validation processes Strong understanding of data integration and data modeling concepts Lead data integration projects and mentor junior engineers Collaborate with cross-functional teams to gather data requirements Collaborate with data scientists and analysts to optimize data flow and storage for advanced analytics Take ownership of the modules …",,,2025-12-24T10:15:57Z,IT Jobs
Power BI Solution Architect,Polestar Analytics,"Noida, Ghaziabad","Job Title : Power BI Architect Location : Noida Job Type : Full-time Experience : 7 years Industry : IT Services & Analytics Job Description Roles & Responsibilities Design and implement enterprise-level Power BI architecture that aligns with business intelligence strategy and data governance standards. Lead the end-to-end BI solution lifecycle including requirements gathering, data modeling, ETL, report design, deployment, and support. Define and enforce Power BI architecture standards, best p…",,,2025-12-07T10:28:59Z,IT Jobs
Senior Azure Data Engineer,KPI Partners,India,"Job Title: Azure Data Engineer Company: KPI Partners Overview: KPI Partners is seeking an experienced Azure Data Engineer with a strong foundation in data engineering, cloud technologies, and big data analytics. The ideal candidate will have 6 years of hands-on experience designing, building, and optimizing data solutions in the Azure ecosystem. This role requires deep expertise in SQL, Python, Azure, Spark, PySpark, and Databricks . Key Responsibilities: Design, develop, and maintain scalable …",,,2025-12-06T01:24:38Z,IT Jobs
Data Analyst,Azurity Pharmaceuticals,"Bangalore, Karnataka","Data Analyst Responsibilities Include: • Interpreting data, analyzing results using statistical techniques. • Developing and implementing data analyses, data collection systems and other strategies that optimize statistical efficiency and quality. • Acquiring data from primary or secondary data sources and maintaining databases. Job Brief: We are looking for a passionate certified Data Analyst. The successful candidate will turn data into information, information into insight and insight into b…",,,2025-11-18T22:32:13Z,IT Jobs
Data Analyst,SveltetechTechnologies Pvt Ltd,"Delhi, India","Data Analyst Job Duties Data analyst responsibilities include conducting full lifecycle analysis to include requirements, activities and design. Data analysts will develop analysis and reporting capabilities. They will also monitor performance and quality control plans to identify improvements. Responsibilities Interpret data, analyze results using statistical techniques and provide ongoing reports Develop and implement databases, data collection systems, data analytics and other strategies tha…",0.0,300000.0,2021-02-15T04:27:43Z,IT Jobs
Data Analyst,Qrata,"Delhi, India","Job Title: Data Analyst Job Brief: The successful candidate will turn data into information, information into insight and insight into business decisions. Data Analyst Job Duties Data analyst responsibilities include conducting full lifecycle analysis to include requirements, activities and design. Data analysts will develop analysis and reporting capabilities. They will also monitor performance and quality control plans to identify improvements. About Us We began in 2015 with an entrepreneuria…",1000000.0,1200000.0,2024-01-07T15:08:07Z,IT Jobs
Data Analyst,Amicus Therapeutics,"Bangalore, Karnataka","Position Description Data Analyst Location: Remote/Bangalore Amicus Therapeutics is a global, patient-dedicated biotechnology company focused on discovering, developing and delivering high-quality medicines for people living with rare metabolic diseases. Position Summary Data analyst responsibilities include conducting full lifecycle analysis to include requirements, activities and design. Data analysts will develop analysis and reporting capabilities. They will also monitor performance and qua…",,,2025-04-16T01:41:37Z,IT Jobs
Data Analyst,Amicus India,"Bangalore, Karnataka","Data Analyst Location: Remote/Bangalore Amicus Therapeutics is a global, patient-dedicated biotechnology company focused on discovering, developing, and delivering high-quality medicines for people living with rare metabolic diseases. Position Summary Data analyst responsibilities include conducting full lifecycle analysis to include requirements, activities and design. Data analysts will develop analysis and reporting capabilities. They will also monitor performance and quality control plans t…",,,2024-07-31T03:12:34Z,IT Jobs
Data Analyst,Qrata,"Delhi, India","Job Title Data Analyst Job Brief The successful candidate will turn data into information, information into insight and insight into business decisions. Data Analyst Job Duties Data analyst responsibilities include conducting full lifecycle analysis to include requirements, activities and design. Data analysts will develop analysis and reporting capabilities. They will also monitor performance and quality control plans to identify improvements. Responsibilities ● Interpret data, analyze results…",800000.0,1300000.0,2024-01-07T15:07:49Z,IT Jobs
Data Analyst,Boolean Staffing Recruitment Solutions Pvt Ltd,"Bangalore, Karnataka","Job Description : We are looking primarily for Data analysts who have experience in analysing the data and have good knowledge on SQL, Python, Tableau and have knowledge/ some exp in ETL. Job Title: Sr. Data Analyst Experience – 5 to 8 Years Location – Bangalore Roles & Responsibilities : We are looking for data analysts who will elicit requirements and translate them into data and analysis requirements. Further they will create data driven insights and dashboards that enable a variety of stake…",2300000.0,2500000.0,2025-12-24T06:24:48Z,IT Jobs
Data Analyst,Fatakpay,India,"Job Title : Data Analyst-Fintech Job Description : We are seeking a highly motivated and detail-oriented Data Analyst with 2 to 4 years of work experience to join our team. The ideal candidate will have a strong analytical mindset, excellent problem-solving skills, and a passion for transforming data into actionable insights. In this role, you will play a pivotal role in gathering, analyzing, and interpreting data to support informed decision-making and drive business growth. Key Responsibiliti…",800000.0,1500000.0,2024-12-07T13:03:54Z,IT Jobs
Data Analyst,ALIQAN Technologies,India,"Job Title: Data Analyst – Insurance Domain Experience: 6 to 12 Years Duration: 6 Months Employment Type: Contractual Work Location: Gurugram & Bangalore (Priority) | Chennai, Pune, Mumbai (Secondary) Job Description: We are looking for an experienced Data Analyst with strong domain knowledge in Insurance and expertise in handling end-to-end data workflows. The ideal candidate should have hands-on experience in data modelling, data analysis, data architecture, and data visualization , along with…",2400000.0,3000000.0,2025-07-03T20:34:28Z,IT Jobs
Data Analyst,ALIQAN Technologies,India,"Data Analyst Job Description: It’s a classic Data Analyst role with Data skills, communication skills (written and verbal), organisation & presentation skills are of paramount importance. Experience: 3 years Employment Type: Contract Location: Remote (UK Client) Expertise in Data Analysis, Data Design and Modelling within Data & Analytics area of an organisation Expertise on related toolsets and scripting languages for data exploration, like AWS Athena, Snowflake Strong technical proficiency in…",100000.0,150000.0,2025-11-28T22:28:02Z,IT Jobs
Data Analyst,Malaysian Global Innovation and Creativity Centre,India,"MaGIC Technology and Product team is looking for a data analyst to help expand and improve data on startups, investors, and founders in the ASEAN region. As part of the data team on our Startup Database product, you will assist in maintaining the accuracy of information on startups and investors, and continuously update our repository with latest publicly available data on the same. The job offers a high degree of autonomy and will also see you playing a leading role in the analysis of the data…",500000.0,1000000.0,2019-06-05T21:12:29Z,IT Jobs
Data Analyst,Chevron,"Bangalore, Karnataka","Total Number of Openings 1 About the position: A Data Analyst is responsible for gathering, analyzing and problem solving as it relates to data, types of data, and relationships among data elements within a business system or IT system and with business domain expertise. A Data Analyst provides expertise on how Business workflows map to data, and how data can be integrated to build reusable data products. A Data analyst will serve as a subject matter expert for delivery teams. The Data Analyst …",,,2025-11-21T22:39:45Z,IT Jobs
Data Analyst,NAVVYASA CONSULTING PRIVATE LIMITED,India,"About the Role We are looking for a highly skilled Data Analyst or Data Scientist with strong expertise in Python and SQL to join our client’s team. The primary responsibility will be to automate data-driven workflows and processes based on detailed business steps provided by the Product and Business teams. The ideal candidate will bridge the gap between analytics, process understanding, and automation execution. Key Responsibilities ● Collaborate with the Business and Product teams to understa…",,,2025-11-20T00:58:08Z,IT Jobs
Data Analyst,Namaste Credit,"Bangalore, Karnataka","About the Role The following Job Specification is intended to reflect the nature, range and context of the work. It identifies the main requirements of the job but is not an exhaustive list of duties. The Data Analyst role is a vital role as to be a sole point of contact responsible for closely working with various teams internally and closely working with the CTO. This role typically requires the resource to analyse the vast number of datasets and provide a meaningful impact and the result of …",500000.0,1000000.0,2020-09-19T01:45:32Z,IT Jobs
Data Analyst,ALIQAN Technologies,"Gurgaon, Haryana","Job Title: Data Analyst Insurance Domain Experience: 9 to 12 Years Duration: 6 Months Employment Type: Contractual Work Location: Gurugram & Bangalore (Priority) | Chennai, Pune, Mumbai (Secondary) Key Responsibilities: Analyze large, complex datasets to identify trends, patterns, and insights relevant to the insurance business. Design and implement data models to support analytical and operational reporting needs. Build and maintain scalable data architectures using cloud platforms such as Azu…",1800000.0,2400000.0,2025-11-10T22:32:11Z,IT Jobs
Data Analyst,ALIQAN Technologies,"Gurgaon, Haryana","Job Title: Data Analyst Insurance Domain Experience: 9 to 12 Years Duration: 6 Months Employment Type: Contractual Work Location: Gurugram & Bangalore (Priority) | Chennai, Pune, Mumbai (Secondary) Key Responsibilities: Analyze large, complex datasets to identify trends, patterns, and insights relevant to the insurance business. Design and implement data models to support analytical and operational reporting needs. Build and maintain scalable data architectures using cloud platforms such as Azu…",,,2025-09-28T01:09:08Z,IT Jobs
Data Analyst,Egnyte,India,"Data Analyst The Data Analyst supports business stewards in the implementation of and best practices for data quality concepts and tools. He/she will be accountable for providing and implementing end-to-end solutions for large complex projects and executing data quality processes. This role operationally supports the larger sales and marketing operations in the organization and partners with the business ops team and other business partners to analyze, troubleshoot and resolve issues through tr…",1000000.0,2000000.0,2024-09-12T11:38:50Z,IT Jobs
Data Analyst,Chevron Corporation,"Bangalore, Karnataka","Total Number of Openings 1 About the position: A Data Analyst is responsible for gathering, analyzing and problem solving as it relates to data, types of data, and relationships among data elements within a business system or IT system and with business domain expertise. A Data Analyst provides expertise on how Business workflows map to data, and how data can be integrated to build reusable data products. A Data analyst will serve as a subject matter expert for delivery teams. The Data Analyst …",,,2025-11-22T05:48:38Z,IT Jobs
Data Analyst,Reality Premedia Services Pvt Ltd,"Pune, Maharashtra","We at Reality Premedia pvt ltd is looking for Data Analyst for Pune location. Must have experience in BFSC domain. Exp- Min 3yrs Location- Pune Mandatory Skills- Exp in powerBI/Tableau, SQL Basic Python Skills:- Tableau, PowerBI and Data Analytics",0.0,800000.0,2021-09-29T05:01:45Z,IT Jobs
Data Analyst,Growth Hub Consultants,"Jeevan Park, West Delhi","Job Overview We are hiring a qualified candidate for a Data Analyst role in our company. You will be responsible for data mining and analysis. You will be conducting an analysis on available data and preparing a report of the same. These reports will further help us in taking appropriate decisions and provide direction to make better business decisions. This job requires you to keep track of data to devise policies and procedures. In this role, you are expected to interpret various data sets an…",,,2025-06-27T05:53:28Z,IT Jobs
Data Analyst,Intelliatx Therapeutics,"Bangalore, Karnataka","Data Analyst – Job Decription Connecting people with each other and the right information is mission critical. Our Company develops innovative cloud-based technology to make it easier, more effective and more efficient to make the right connections. Our solutions put people in sync with each other and the right information, so they gain the insight needed to reach better decisions on the issues that matter most. We do it with a laser focus on reliability. The Company is a leading provider of te…",,,2025-11-19T22:19:09Z,IT Jobs
Data Analyst,PubMatic,"Pune, Maharashtra","About The Role PubMatic is looking for a sharp analytical individual to work as a Data Analyst in the Finance Reporting & Insights function. People with a penchant for extracting the truth out of numbers and summarizing it for the finance and operations teams would be the best fit for the role. What You'll Do The Data Analyst will be responsible for collecting and analyzing tremendous data sets using tools such as Microsoft Excel, Access, SQL and Hive databases and presenting them in easy-to-un…",,,2025-12-17T20:01:06Z,IT Jobs
Data Analyst,PubMatic,India,"About the Role PubMatic is looking for a sharp analytical individual to work as a Data Analyst in the Finance Reporting & Insights function. People with a penchant for extracting the truth out of numbers and summarizing it for the finance and operations teams would be the best fit for the role. What You'll Do The Data Analyst will be responsible for collecting and analyzing tremendous data sets using tools such as Microsoft Excel, Access, SQL and Hive databases and presenting them in easy-to-un…",,,2025-08-12T17:23:49Z,IT Jobs
Data Analyst,RegisterKaro,India,"Job Description: Data Analyst Position: Data Analyst Location: Gurgaon Experience Level: 1-3 Years Employment Type: Full-Time Role Overview We are looking for a results-driven Data Analyst to join our team and support business decision-making through data insights and analytics. The ideal candidate will be highly proficient in Python, skilled in data visualization tools, and experienced in solving complex problems to drive measurable business outcomes such as revenue growth or cost reduction. K…",400000.0,1000000.0,2025-01-01T11:53:10Z,IT Jobs
